review_text,stars
"Вместо быстрого обслуживания получаешь томное и долгое обслуживание 
Насчет еды это 5 звезд 
Вкусно и красиво",2
Самый вкусный пицццааа👍🏻👍🏻👍🏻,5
"Самый лучший филиал! Обслуживание на высшем уровне, атмосфера уютная, персонал внимательный. Хочу особенно отметить кассира Жансая шустрая, улыбчивая, всё делает быстро и с хорошим настроением. Спасибо за отличный сервис, обязательно вернусь ещё раз!👍🏼👍🏼👍🏼😄😄😄",5
"Өмірімді жеген ең дәмді пицца осы шығар 😍
Қыздарда күшті обслужование жасайды екен ❤️",5
"Всё было вкусно! Кассир Жансая помогла выбрать пиццу, всё подробно объяснила. Очень приятная и шустрая девушка. Спасибо большое!☺️",5
"Очень вкусно, и красивые кассиры❤️",5
"кассир Жансая такая приятная, молодец!❤️☺️",5
Все Гуд,5
"Отличная пицца, хорошое обслуживание.
Все на высшем уровне!👍🏻",5
Очень вкусно и быстро🔥🔥🔥,5
Нұрзия кассир өте сыпайы 😘👍,5
"Прекрасные продавцы,посоветовали и быстро подготовили пиццу",5
Очень вкусно и приятная музыка,5
Дәмді😋,5
"И за таких людей, ищешь место где поесть. На улице капал дождь, сидят и превращают в игральную. ЕСТЬ СПЕЦИАЛЬНЫЕ МЕСТА ДЛЯ НАСТОЛОК! Выгоняйте таких людей, это не место для таких развлечений. МЫ ПРИХОДИМ ПОЕСТЬ!!!",1
"Если выбирать то эту точку. Вкусно быстро и уютно, всегда убрано. В додо в целом выгодно вкусно поесть, насчет бонусов в приложении. Гавайская отдельная любовь",5
"Күшті керемет қазақша мәзір 👍Ақерке деген кассир қыз өз жұмысына мықты екен, риза болдым.",5
"Работники отказывались принимать заказ,оправдывая это неуспеваемостью в приготовлении из-за большого количества заказов,но занят был один стол.Приезжаем в филиал расположенный в форуме,там говорят что пиццы нет.Вы уж придумайте одну версию лжи и не тратьте время посетителей",1
"Сегодня тоже столкнулась с проблемой туалета в данном филиале. Сделала заказ, поела, захотела посетить уборную. Но увы, этого не вышло, так как ее ПОЛНОСТЬЮ закрыли минут на 15!!!!
Неужели нельзя было частично закрыть кабинки и мыть?!
Пришлось сидеть и ждать, так же как и посетителям с детьми. 
Плюс дендвич с кониной разочаровал, у другого человека был дендвич с ветчиной и была свежая чиабатта, у меня засохшая и пахла старой .. печально. Не стоит он 1.900 тг.
Прилагаю пусть не эстетичные,но правдивые фото.",3
"Чтобы зайти в туалет нужно спрашивать пароль , и говорят нужно делать заказ , дурдом . Ранее брала кофе и ходила к ним , теперь принципиально не буду ходить , не советую всем, ущемляют права людей .",1
Тамақтары маған ұнады әсіресе кассирлары жақсы қызмет атқарып жүрді 👍🏻✨🤩,5
"Время 00:22, целенаправленно шли в додо, в итоге они не работают. Сотрудники сказали что закрылись. Хотя написано, что работают до 3 часов ночи. Какой то бред",1
"Кассир Акерке очень красавица, обслуживание супер там чай прям вкусно ребята советую Цитрусовый чай!",5
Мағжан крассавчик өте жақсы обслужования жасады.,5
Всегда вкусно😋,5
"Худший опыт за долгое время!!!! Компания  Dodo Pizza окончательно лишена человеческих ценностей. Искренне не рекомендую иметь с ними никому дело и предлагаю  закенселить эту бесчеловечную компанию крохоборов. И вот почему 👇🏼

Пришла в Dodo pizza в экстренной ситуации -у меня сильно болел живот, срочно нужен был туалет. На двери кодовый замок. Когда я спросила, как попасть внутрь, мне холодно заявили: “Сначала сделайте заказ.” Объяснила, что денег с собой не взяла, что ситуация экстренная — в ответ услышала бездушное “нет”.



В итоге мне пришлось искать деньги и покупать у них напиток, который мне был совершенно не нужен, и по завышенной цене. И что вы думаете? После оплаты мне говорят: “В туалет нельзя, уборка, ждите 10 минут.” ЭТО НИКАК НЕ БЫЛО ОЗВУЧЕНО заранее! То есть сначала заставили купить, а потом просто оставили ждать.

Абсолютное отсутствие человечности и уважения к людям. Механически вымогают деньги, даже в экстренных ситуациях, при этом не информируют об ограничениях. Желаю каждому сотруднику, кто так поступил, оказаться в подобной ситуации сам.

Категорически не рекомендую. Никогда сюда больше не приду и другим не советую.

Мы были постоянными клиентами Dodo Pizza — заказывали еду для семьи, для гостей, делали крупные заказы на мероприятия. Но после сегодняшнего унизительного опыта для нас эта компания больше не существует.
Когда в экстренной ситуации мне отказали в доступе в туалет без заказа, проявили абсолютное безразличие и заставили покупать ненужный напиток, чтобы потом ещё и заставить ждать уборку — для меня всё стало окончательно ясно.
Такое отношение к людям недопустимо.
Ни я, ни моя семья, ни наши друзья больше никогда не закажем ничего в Dodo Pizza. И каждому, кто ценит человеческое отношение и уважение, я искренне НЕ рекомендую иметь с ними дело.",1
Ждали около часа все заказы после нас были выданы.,1
"Люди сидят целуются, чуть ли не едят друг друга . Сотрудники заведения не смотрят. За 12 столом ужас просто! Отправительнь смотреть. Еще казак кыз орыспен! Ужас просто",1
"Заказал блины с мясом и грибами — внутри были холодные. Поменяли, хоть и немного долго, но за ожидание дали компенсацию.",5
Аружан отличное обслуживание без лишних слов по делу как по маслу спасибо!,5
"Очень вкусно, все кассиры такие классные всегда радостные и уборные всегда чистые, теплого водичку наливают для сына на радость , рекомендую 👍🏻",5
Самый лучший филиал ДоДо,5
Хорошее заведение.,5
Аружан лучшая. Додо 🐐🥰😘😜,5
Аружан күшті жұмыс жасайды екен !,3
Аружан керемет қызғой,5
"Лучший персонал! Забыла сумку, позвонила им через час уже. И оператор, и администратор оперативно помогли и заметили сумку которую оставила) спасибо!",5
.,5
Нет меню на казахском языке,1
Аружан топ топ,5
"Здравствуйте, администрация пиццы ДоДо. Покушали с товарищем, было очень вкусно. Спасибо за обслуживание.",5
Хорошое заведение! Я бы оценил на 9.5/10. Также отличная система и приложение которое показывает камеру!😍,5
Всегда вкусно,5
"Взяли 3 пиццы для угощения. Приготовили быстро. Вежливый персонал. Очень понравилась пицца всем, кто пришел на выставку молодых художниц, на Шарипова 124, гаражи. Спасибо!",5
"Ужасное место,пока не заказал в туалет нельзя,мне че пол часа стоять терпеть пока заказываю?",1
👍,5
Сервис на нуле час ждеш одну пицу👎👎👎👎,1
"Заказал доставку на дом комбо две пиццы и американо.
С одной стороны хорошо что позаботились о том, чтобы продукт был герметично запакован и не разлился, но мне кажется перестарались (лучше использовать другую возможность) ибо все было по варварски переклеено толстым слоем бумаги и клей размазался по всей упаковке. Надеюсь не попал в содержимое стакана, ибо это может иметь негативный эффект на здоровье потребителя. После открытия стаканчика от кофе пришлось тщательно мыть руки от клея трижды, и я все равно продолжаю ощущать небольшой от него эффект. Жду пока кофе остынет чтобы попробовать на вкус и дать апдейт. Три звезды за то что никогда до этого не разочаровывали😌",3
"Супер, вкусная пиица и стафф классный",5
"самая лучшая точка,удобное расположение.Работники тоже все приятные,всегда после пар или во время окна приходим покушать.Вот пиццы тут реальные вкусные,даже кофе вкусно готовят что не обычно.Рекомендую для всех!",5
Было очень вкусно👍🏻,5
Облуживание и круассаны не очень,3
"Кассирша Ақерке красивая ,очень вежливо упоковала заказ 👍🏻🙌🏻",5
Ништяк,5
моя любофф прост,5
"тут вкусно, но сырного соуса вечно не бывает🤓✋🏿✋🏿✋🏿",4
"Это действительно худший филиал, я думал тесто везде одинаково делают, нет здесь оно толстое… сама пицца сырная просто отвратная. Возможно так потому что ночью заказывал, может устали, но совсем не вкусно.",1
"Очень рекомендую это заведение худеющим людям. Готовят долго. Пока ждал свой заказ, успел сбросить 5кг.",1
Вообще дәмі ужас 2800 тг кеткен жалко куйдирип жіберген пиццаны кайтып дододан пицца алмаймыз 🤮 1жулдыздың ози жалко,1
Разрешили поставить телефон на зарядку,5
Керемет тез дайындалады,5
"Кассир грубая , не рекомендую портить настроение и приходить сюда",1
Ыңғайлы. Таза. Дәмді👍🏻,5
вкусно.,5
Вкусно,5
"Единственный филиал который готовит так невкусно, на фото пицца «пепперони» по факту это лепешка с сыром и колбасой, без специй и вкуса. Соуса не было на 4х кусках из 6, не рекомендую",1
Прям ооооочень вкусно🤤❤️,5
"Понравилось сервис, очень вежливые кассиры были сегодня утром, все упаковали собой как я хотел, забыл имя посмотреть но она красотка😍😍, все понравилось, все вкусно❤️❤️❤️",5
вкусно,5
Бәрі ұнады🥰🥰🥰,5
Осы додо пицца күшті. Маған ұнайды. Қыздарыда жақсы қызмет көрсетеді және сыпайы сөйлейді.🍕👍,5
Супер❤️,5
"Комфортно. Если хотите посидеть с друзьями и покушать вкусно, то это идеальное место. 🥳",5
"Аружан кассир ұнады ,сыпайы тапсырысты жаксы қабылдап ,жылдам ары тез😍👍🏻👍🏻",5
"Туалет по коду, а если бы человеку плохо было?",1
Қыздарға көп рахмет! Жылдам және сапалы қызмет көрсетті🙏🏻,5
самая лучшая и вкусная пицца в Казахстане,5
"Здесь можно купить две маленьких пиццы всего за четыре тысячи, недорого и вкусно. Пиццы сделали очень быстро, особенно на вкус понравилась сырная, сочетание сыров в ней очень удачное. Еще есть классное приложение, там можно заказать доставку или заказать пиццу заранее. Также можно выбрать тесто, классическое или очень тонкое, или добавить что то в начинку. Так как этот филиал рядом с работой, зайду к вам как нибудь еще",5
Персонал очень отзывчивый - ПРОСТО СУПЕР!!!!!!!!!!!,5
Перепутали заказ,3
"Сколько покупал здесь пиццу, Аль-хамду ли-Ллях, никогда не жалел об этом. Пицца всегда вкусная и сытная. Как и сама пицца, кассиры: вежливые, добрые и очень приятно разговаривают. Нередко можно увидеть картину, когда они радостно подшучивают между собой, что вызывает ощущение, что тут добрые и милые люди, которые уважают друг-друга и очень поддерживают. Наверное, минус это только цены, они порой слишком высокие, но понять почему так можно. Но, однозначно, место, а главное то, ради чего все приходят в Додо - пицца - стоят того, ведь она очень вкусная. В общем, ма ша Аллах! Удачи вам пиццерия, растите, расширяйтесь и держите планку. Спасибо вам за старания!",5
"Кассиры просто супер, молодцы. Особенно Жақсылық👍🏻",5
"Вчера были там вместе с друзьями, все было почти хорошо, не считая одного случая у нас прям внутри одного куска пиццы был длинный волос. Акцент на том что он был внутри самой пиццы, теста и соуса ну то есть он не мог попасть туда он людей которые ходят мимо. Когда решил подойти сказать на кассу, все что сказал менеджер в недовольном тоне цитирую «И вы это заметили когда осталось 2 куска пиццы?» ну блин да или мы должны были надкусить каждую пиццу. Второй аргумент менеджера было то что у нас нету Блондинов так как волос светлый и все носят шапки а вдруг это было в заготовках так как это сфера фастфуда. 
Сейчас прикреплю фото. На минуточку он был в двух кусках и попал в рот моей подруге. Очень неприятная ситуация больше никогда там не будем собираться. 2 звезды только за локацию удобную, дизайн и то что удобно заказывать.",2
Алмат хороший сотрудник все вежливо обслуживал .Повышайте его 👍,5
Кассадагы Аружан деген кыз😍,5
"В туалете нет даже мыла! Ни влажные салфетки не выдают даже. Долгое обслуживание, говорят, что только один кассовый аппарат работает.",2
Хотите маленький додстер вам сюда кассирша разговаривает с таким тоном как будто всей жизнью не довольна зря потрачены деньги,2
Любимая пиццерия😍,5
"Вкусно , но нету места для парковки",5
"Фри домашны не хрустяши
Шампиньоны не понятно",1
Круто интерьер крутой мы ждем заказ,5
"Кассирша приятная и вежливая.
Заказывала додстер был подгорелый и тесто неприятного вкуса 💔 . Столы чистые ,но сидения были грязные",3
Вкусно! И вежливый персонал!,5
"Заказала рулетики с корицей… нужно или добавить корицы или добавить сахара, ни того, ни того не хватает ( по внешнему виду 0/10, ладно если бы они были одинаковыми, так один большой, другой маленький, третьего вообще половина только) . Пицца 4 сезона… я живу около 1-Алматы и там все аккуратно и красиво. Тут… Один кусок 5 сантиметров, второй 10, а третий 2…. По вкусу намного хуже, чем на 1 Алмате.",4
"Была тут вечером 15.01.2025 

Из плюсов: очень приятный интерьер как снаружи, так и внутри. Вкусная еда, сеть Додо меня всегда в этом отношении радует. 

Из минусов: на столах не убираются, чужие остатки еды лежат несколько часов, от чего неприятно за них садиться.

Был подгорелый додстер, тесто которого было неприятно есть, хотя в других филиалах такого никогда не замечала.

Одна и та жа песня играла без остановки два часа, с момента как мы пришли и вплоть до того, как покинули заведение. Динамики заведения были настроены на среднюю громкость, песня в какой-то момент стала навязчивой. Неужели администрация два часа подряд не могла понять, что у них раз за разом играет одна и та жа песня, и что это может быть неприятно?

Ну и плюсом, девочки-кассирши отходили от своего рабочего места, до них не достучаться и не дозваться. Зову, они меня видят, но не подходят. Такое в Додо у меня тоже впервые. Если нужна помощь на кухне - нанимайте дополнительный персонал, а кассиры пусть выполняют свою работу.",3
Всегда открыто,5
"В туалете вкусно пахнет🥰 и пицца тоже гуд, но за уборную 5 звезд",5
"Тут всегда вкусно, тесто для пиццу офигенное, а наполнение никогда не желают, кладут качественные продукты и много, сыр тянется, правда фри средний было маловато для своих денег, в целом еда и интерьер топ",5
Заказали две пиццы скушать в заведении. Готовили эти две пиццы час... Это заведение быстрого питания! Крайне недоволен обслуживанием...,2
Азамат сладкий,5
"Заказала в 7 утра на 9:00ч. Курьер спорит и сделал отмену, ужас просто🤦🏻‍♀️лучше у них не заказывать",1
Хорошо готовят вкусно отлично,5
Почему никто не пишет про ПОВАРОВ (пицца мейкеров😭),5
Супер просто 🫶🏻,5
Официанты были очень приветливыми👌🫶🏻,5
"Только что заказали еду, сели кушать, ели пиццу и между кусочками пиццы, были остатки жаренного лука, моркови(они либо разрезали пиццу грязным роллером, или не знаю что) подошел к кассиру объяснил это, они сказали, а хорошо, извините, и отдают пиццу мне обратно в руки, я говорю что не буду это есть, они сказали хорошо,по идее в таких ситуациях можно было что-то предложить ради вашего же сервиса. Изначально кассирша не понравилась, будто общается через не хочу и одолжение делает.",1
"Плохая точка. В середине дня, в обедненное время, у них там какие-то сбои в системе, и заказать нельзя ничего, кроме напитков 🤷🏻‍♂️🤦🏻‍♂️",1
"Очень понравилась пицца, спасибо",5
