review_text,stars
"Не принимали заказ сказав что касса не работает, в итоге пришлось заказывать через терминал, по терминалу нет половины меню, грубые работники которым все равно стоишь ты у кассы или что то спрашиваешь, в итоге гаркнули что касса не работает и все дальше и дела нет",1
"На кассе нет кассира , ждали очередь а сказали что касса не работает. Могли бы сказать заранее об этом. Обслуживание ужасно.",1
"Заказали 2 миринды и 2 разных твистера (острый и не острый). Дали 2 пепси и 2 острых твистера. На наше возражение, что мы просили другое, ответили что уже пробили так и поменять невозможно. Почему-то тот факт, что они пробили неправильно считается нашей проблемой 🤷🏽‍♀️",2
"Ущербные, не рекомендую",1
"Все быстро и вкусно, особенно понравился работник Мейрамбек, все четко объясняет и главное вежливый. Еда очень вкусная, буду часто заходить. И вам советую!!!",5
"Ужасно не вкусно совсем испортили кфс! Это совсем и не кфс же! И ничего нет комбо не крыльев! Нагетсы ужасные,вместо острых положили не острые ножки ! Возмутительно!!!!!!",1
Огромное спасибо сотрудником за отличное обслуживание,5
Бәрі өте дәмді👍🏻,5
Все вкусно и кассир очень вежливо спасиба за работу,5
"Пришла по ужинать и там был такой невоспитанный кассир Дархан, я вот понят не могу зачем брать менеджера если кассиры решают за них и в то же время не грамотно кассир Хам одним словом а менеджер вообще 0 !! Не знает своих обязанности!!! Даже не подходят не решают вопросы клиента! За них решение принимает Какой то кассир Дархан и в то же время безграмотный!Зачем там ходит менеджер если все до ходит до конфликта!!!! Примите меры !!!чтобы каждый занимался своими делами!!!!! Ужасное заведение одни хамы и не учи !!! И никто не соблюдает санитарные правила!!!! У всех грязные вещи и без колпаков ходят .",1
"На кассе стоят бараны, пока не скажешь чтоб приняли заказ, можешь простоять хоть весь день, ходят как будто тебя там нет.
И что за тупая идея не продавать крылышки без стрипсов? Если я не люблю стрипсы зачем я их должен покупать? 
Больше не ногой в kfc.",1
Ужасное обслуживание!!! Вечно недодают элементы заказа!!!,1
"кассирша грубая, хотя я просто спросила что идет в бокс, не увидела меню (моя вина), но все же, вместо того чтобы сказать или показать, нагрубила и показала в меню :( Даже на другие вопросы отвечала с каким то негативом, что то быстро пробила и ушла 
ничего не сказала, настроение испортила
шла именно в эту точку
из плюсов заказ приготовили быстро и там довольно чисто 
вкус как и в других кфс 
когда работаете в сфере обсуждения надо хотя бы пытаться быть вежливой.",3
заказы собирает только один человек! заказы очень долго выдают🥹💔💔,1
"Очень быстрое приготовление заказов! Повторюсь, очень быстро! Продукты свежие. Остались довольны.",5
Кассир очень грубый и невнимательный. Пробил одно и тоже два раза ! Вечно недовольное лицо,1
"Верните на доставку крылья, вы же кфс! Из боксов убрали крылья, теперь их вообще заказать нельзя, что за бред",1
Самые вкусные крылышки готовят в этом филиале😋,5
Хорошее облуживание Молодцы,5
Вкусно было,5
Бәрі өте дәмді👍👍👍,5
"Все круто, обслуживание на высшем уровне, особенно работница Аманкуль апай, ояень вежливая, приветливая, знает свою работу,все чисто и сверкает😍",5
Нет боксмастера и просто острых крыльев. На кой черт мне эти стрипсы?,1
Курьермін 40 минут күттім,1
"Было очень вкусно,всей семьей остались довольны.😍❤️☺️",5
Сая молодец күшті обслуживание жасайды👏,5
Очень вкусно.Спасибо вам,5
"Пахнет как на базаре в мясном павильоне 🤢 даже брать не стали ничего, жаль",2
Я заказывал через доставку быстро и качественно горячий пришёл. Заказ точно собирали спасибо ребята,5
"Заказала еду с собой сегодня, 18.08.23 У вашего официанта-кассира Асель, приехав домой обнаружила что фри она не пробила, лять у нее проблемы со слухом или как? Как можно не услышать ? Да и что можно увидеть в этом чеке, Не видно ничего, если краска закончилась в принтере нужно его менять!!!
Еще один момент который меня добил, это: приняв заказ говорит с вас десять тысяч восемь девять» она просто съела конец слов, даю ей 10500 она молча смотрит на меня ,переспросила десять тысяч 89 тенге или десять тысяч восемьсот девяносто? На то она просто кивнула головой, она вообще у вас считать не умеет ?или плохо с русским? Если второй вариант ,то простительно , можно было казакша айтуга!",1
"Ну ребята ,я восхищаю вашего скоростью
Спасибо вам",5
Осы тәте байтс фри алдың деп бокал берми қойды. Если посуда бермесеңдер менюдан алып тастандар,1
4.08.23 куни болган кыз х»ева жумыс истит уволит надо нахрен кассада турган кыз,1
"Сегодня заказал боксмастер, но мясо было сырым. Есть такое было невозможно. Хотя в прошлые посещения все было нормально. Так что если придете в это заведение имейте ввиду что могут подать некачественный продукт.",1
"Персонал невоспитанные, не уважают абсолютно друг друга.",1
Влажные салфетки ужасно пахнут,2
"Очень вкусная продукция, всем советую👌🫶🏻",5
Все было вкусно и быстро спасибо ребята,5
Очень быстро и вкусно 🤤,5
Все быстро! Спасибо!,5
Классно быстро,5
Все супер ☺️☺️☺️☺️,5
"Был сегодня в этом филиале ""КFC"", до этого был почти во всех филиалах КФС, заказал 3 Сандерс баскета, порции очеееень маленькие, стрипсов вообще мало, ножек тоже нету, за 3 баскета ложили 2ножек,по 2крылешек,и пару стрипсов. порции очень мало, не по калькуляции ложат, сами кушают походу, в других филиалах порции нормальные, 2Сандерс баскета ел, не наелся. Спасибо большое, не приду больше...",1
Все очень быстро дали вкусно,5
Ножки вкусныеее дети в восторге мы рады,5
Персонал классный все вкусно мы рады,5
Лучший……..,5
"Керемет супер, обслуживание тож на высоте😍 Советую, дәмді екен.",5
Мы с семьей пришли покушать сюда все очень вкусно персонал отзывчивый,5
"Классный сервис, все быстро и оперативно а главное по всем пожеланиям, хочу также отметить кассира Арлана очень хорошо принимает заказы, в самом заведение очень чисто и уборные , и посещение.",5
"Купили крылышки в тот раз базар жок вкусно, но сильно прожарили",3
"Было очень вкусно, всей семьей остались довольны. Обязательно придём на следующий неделе еще 😊",5
Все очень вкусно! Персонал вежливый👍🏻👍🏻,5
"Еда очень вкусная, персонал приветливый, буду приходить еще",5
"Быстрый сбор, вкусная еда, опрятный внешний вид, не хамят, не грубят. Ответственные работники приятные цена",5
Все вкусно хорошо обслуживает 😍😘,5
"С семьёй являемся постоянными клиентами. Никогда не возникало проблем. Персонал вежливый, еда вкусная, в зале чисто и убрано. Спасибо за сервис 👍🏼",5
Приветливый и вежливый персонал. Все понравилось.,5
"Был здесь недавно с семьей, все отлично, обслуживание быстрое , 10/10
Особенно хочется отметить менеджера Адама за хорошее и быстрое обслуживание",5
"все было вкусно, сотрудники приветливые👍🏻",5
Все было вкусно,5
"Заказали через Яндекс еда
Привезли во первых совсем не то, чек тот, а сам заказ не правильно положили
Во вторых в бургере соусы пропавшие, не рискнули есть, крылышки маленькие... Не заказывайте и не ходите сюда",1
"Фри, наггетсы - все вкусное. Главный минус, испортивший весь настрой это техничка, грубая очень. Научите персонал не быть такими, очень неприятно. Люди кушают, а они просят поднять ноги и помыть пол. Помыли пол и в приказном тоне просят не вставать и подождать.",3
грубый и безответственный персонал,1
Очень долгое обслуживание. Концепция подобных заведений в скорости.,1
"Заказала 10 куриных ножек не острых, из них 3 оказались острыми. Фри какой то вялый, без вкуса.👎👎👎👎👎",1
Хорошее обслуживание😋😋😋👍👍👍,5
Өте дәмді әрі тез,5
Все было вкусно спасибо всемм👏👏👏,5
Қызмет көрсету өте төмен особенно Мақпал деген қыз,1
Рахмет оте керемет,5
"Ужасный филиал. Все медленные, грубые, готовят отвратительно. Худшая точка!",1
Сделали ужасный сгоревший сет невозможно поесть ещё и твёрдые очень,1
"Заказывала комбо через Яндекс доставку, заказ не доставили, потому что он не был передан курьеру. 
Это говорит о том что у вас полное отсутствие коммутации кассиров с курьерами и вы не следите за тем кому выдается заказ, а раздаете их всем подряд без проверки. Поэтому заказывая в КФС на этой точке, будьте более бдительными, потому что ваш заказ может забрать кто-то другой.",1
"Привезли заказ 5 минут назад. Не хватает одного сырного соуса, пепси, мини баскет фри. Когда довезут заказ нам?",1
Все горячий и вкусно спасибо всем ребята,5
"Зашли совершенно случайно поужинать, обслуживание на отвали, еда не свежая картошка не хрустящая бургеры как попало сделаны в итоге ничего не доели и вышли(",1
Отвратительное обслуживание! Даже не написали что точка сегодня не работает.,1
Подсела уборщица) Приятная компания но все же хотелось бы побыть одному и тихо покушать,1
Хорошие заведения все вкусно и хорошо готовить спасибо ❤️,5
"Очень вкусная продукция , всем советую",5
Все отлично,5
"Еда мусор… заказал ведро и забрал с собой… ножки испорченные… KFC испортит вам здоровье… не ходите туда, они вас травят… больше никогда… 🤢🤮",1
"Ужасно, долгое обслуживание. Увеличьте штат! Очередь. Заказы по 40-50 минут отдают.",1
"В моём заказе было всего 2 позиции. Я не понимаю, что сложно того в том, чтобы положить в пакет позиции по списку… что ресторан не внимательный, что курьер как робот берет и не проверяет, а платим то полную сумму. На жалобы 0 реакции, вообщем наёмщики одни",1
"Просто 🤮 фри вареный , а не жаренный пепси на разлив РАЗБАВЛЕННЫЙ 😡это самый худший KFC по городу.",2
"Вкус еды супер 
Обслуживание 👍",5
Все вкусно было спасибо классно готовить,5
"Мы сегодня заехали в кфс, вкусно было кебаб. Спасибо вам всем",5
"Обслуживание на отличном уровне, персонал вежливый, вся еда выглядит очень аппетитно и вкусная",5
Спасибо за быстрое обслуживание скорость и качество супер,5
Отличный ресторан все чисто🤩🤩,5
Все понравилась вкусно и быстро,5
"Хорошее обслуживание ,приветливый персонал✅",5
"Быстрое обслуживание спасибо большое 🫶🏻
Сотрудница Аяна просто молодец 🔥😍",5
"Хорошее обслуживание ,приветливый персонал",5
Самый лучший персонал!!! ВСЕ ВКУСНО И БЫСТРО 😊😊😊,5
"Отличное заведение! Ассортимент хорошие, всё вкусное.",5
"Очень милое заведение, приветливый персонал, который общается с тобой как с другом. Довольно большое меню, надо потратить время, чтобы выбрать, что заказать. Всё очень вкусно. Интерьер довольно приятный, по- домашнему Цены очень доступные",5
"Вчера были на ифтаре ,было очень вкусно ,отдельное спасибо девушка кассирше очень помогла с выбором😍👍",5
Отличный сервис,5
Еда было очень вкусно и сотрудники были вежливыми😊,5
Мне все понравилось. Ставлю 5 звезд.,5
"Огромное спасибо за прекрасную обстановку, приятное обслуживание особенно девушке Аяне!!!",5
"Вчера на ифтаре покушали здесь, было вкусно и сытно! Заказали новинку твистер кебаб очень сочный и вкусный. Всем советую твистер кебаб",5
Сотрудница Аяна топ 🙏🥰,5
понравились сотрудники)все быстро убирали и приносили 👍🏻,5
"Заказали с собой. Бургер пересоленый, вся еда остывшая. Картошка валялась в пакете чуть ли не вверх дном. Печальная история",3
Только наличными. Безналичной оплаты нет,1
Соьрудники 👎,1
для кыс пойдет,4
"Кассир очень грубый!
Столики все грязные, туалеты воняют",1
"Вы издеваетесь? Уже который раз забывают что то положить! Минут 15 назад заказали крылишки, байтсы и фри, на кассе не проверили заказ, пришли нет байтсов! Это не первый раз! Если бы фри забыли, но постоянно роллы, то кол-во крыльев и тд! Амнезия у работников что ли?! Каждый раз ладно ладно, едем обратно, говорят больше не повторится, и вот опят!! Так и без байтса остались в этот раз, об остальных молчу просто!!!",1
Жареные куриные ножки невкусные :((((,1
"Как не приду касса не работает,а на терминале вся Алматы стоит в очереди",5
"Ужасно, и не вкусно",1
Самое мерзкое заведение в городе,1
"Я доволен сервисом ресторана , спасибо вам 👍",5
"Про долгое ожидание не говорят, при этом ждать приходится 20 минут минимум, люди пришедшие после, уже поели и ушли. Беда с сервисом",2
Заказала твистер кебаб отстой одна картошка внутри. Пепси вода без вкусная. Обслуживание быстрое,1
"Добрый день!!!
На счёт заведение команда оперативно работает все вкусно 😋",5
"Хорошо ресторан, Хорошо посидели. Ребята молодцы. Быстро и четко!)",5
"Персонал очень грубый а именно девушка Жамига после заказа опитит пропал , руководству спасибо но персонал особенно Жамига груба очень, как будто у себя дома ходить",1
"Добрый день!!!
На счёт заведение команда оперативно работает.
Спасибо за Аяну и Адаму очень быстро обслуживание !!))",5
"Отлично провели время с друзьями, хорошо посидели Лучший сервис!",5
"Взял деньги, не доставили! Ждали 3 часа. Теперь не взращают деньги!",1
Ужасный сервис Думаю колоссальная разница между фотами. Нужно по два три раза ходить то за салфетками то за приборами при этом нет никого зашива,1
"Еда как везде, но вот персонал просто ужасный 🤬🤬🤬
Сидели мы с подругой на диване кушали и никого не трогали, как к нам то персонал по уборке говорила освобождать место для других и уходить, то напоследок вообще клиентка подошла сказала нагла вставать и отдать им место, на что я сказала вызвать охрану. Персонал Сказал что охраны нет и никто вам не поможет.",1
Закрыто (..,1
"Заказала еду с собой . У них не было размены во первых (принимал сам директор заказ ) . Попросили купить соусы . В итоге ни соусов , ни стрипсов нет !!!!!!! Хотя я покупала бокс 
Это что за ужас ????? 
Курочка тоже ужасная . !!!!!!!
Не советую брать у них .",1
"Заказывала еду на дом, от курицы там только название одна панировка и гнилая картошка, от еды был неприятный запах",1
"Стафф шустрый, очередь движется быстро)
Сама еда стандарт для Кентукки. Жаль, твистеры стали меньше, но это теперь везде.",4
Очень вкусно готовить!Хорошие обслуживание!,5
Все отлично и вкусно. Хорошее обслуживание 👍👍,5
"Все нравится, хорошое обслуживание, персонал очень чистый, добрый, девушка по имени Аяна очень милая",5
Сәлеметсіздерме өте керемет точка тез тез дайын болады жұмыскерлері сыпайы ақ жарқын екен сіздерге рахмет❤️,5
"Еда очень вкусная, сервис оперативный, хороший",5
20 минут назад купили. ножки и крылышки должно было быть. домой приехали крыдышки есть ножек нет. весь аппетит испортили.,1
"Спасибо огромное! Обслуживание отличное, все очень вкусно! Думаю, что будем частыми гостями.",5
"Всё было очень вкусно, обслуживание отличное, чистота и порядок. Мы довольные, сытые, будем иметь ввиду это прекрасное заведение. Спасибо,",5
