review_text,stars
"Рыба гниёт с головы, как говорится…
Честно, до последнего не хотела писать этот отзыв, я просто поражена мягко сказать этой ситуацией. Приходила к вам в заведение, у меня разрядился телефон, без задней мысли попросила поставить телефон на зарядку(НА МОЮ) отнесла сама на бар, поставил вроде как бармен, знать я этого уже не могу. И все ничего, дома я обнаружила, что мне подменили зарядку, как это возможно? А фиг его знает, я приехала забрать свою зарядку, администраторше по 🥁. Отношение, будто я пришла к ним домой с улицы. Зарядку мне не отдали, сказали якобы бармен у которого моя зарядка выходные и я должна ждать СВОЮ ВЕЩЬ 4 дня, эти нормально?! Админ Асель оставила свои контакты, я писала ей на вотсап, но так ни разу не получила ответа. Приехала через несколько дней снова, а там другой админ, отдали мне зарядку ВСЯ грязная, ну неужели так выглядит моя зарядка, которой полгода нет! Конечно нет, теперь я заряжаюсь китайской зарядкой, которая портит мою батарею на телефоне, пока ваш работник пользуется моей вещью, круто, никто даже не принёс извинения. К ним ни ногой, отвратное заведение и лёд в коктейлях у вас огромный - экономия, как говорится 😉 Почитала комментарии  и поняла, что наглый персонал здесь - это нормально.",1
"Еда не вкусная((( В 100й раз убеждаюсь в том, что чем красивее интерьер и дороже меню, тем отвратительнее еда. Пока не принесли заказ, глаз радовался интерьеру и атмосфере, фоновая музыка интересная. Но когда мы увидели еду, она уже на вид не вкусная была(( Одно блюдо стоит средне 4000 тг. Чесночный хлеб  как будто подросток впервые приготовил. Просто не понимаю, почему владельцам не стыдно за такую ужасную кухню(( даже мне за них стыдно(( я даже дома лучше готовлю.",2
"Кухня оставляет желать лучшего(, плюс зашли с ребенком перекусить и заказали фри с сэндвичем для ребенка, но именно это блюдо официант забыл, продолжали заказ больше 30 минут, не понравилось заведение, больше пафоса",1
"Неуютное заведение, мне не зашло. А еще дверь туалета заклинило;(",2
"Встретили Новый год в этом заведении с подругами. Отличное обслуживание, крутая шоу-программа с интересными конкурсами, очень вкусная кухня и уютная атмосфера. Выражаю благодарность официанту Ермахану и менеджеру Асель за сервис и любезность.",5
Шумная музыка. Не посидишь не поболтаешь. Надо перекрикивать фоновую музыку. Вроде танцпола я не видел. Во всяком случае на 1 этаже,3
"не понравилась кухня что мясо, что морепродукты. гости иногда такие отвратительные… лимонады 🤦🏻‍♀️ это кошмар выжали лимон разбавили с водой называется, отвратительный «вкус» кислая вода. 
напьются и кричат, орут на весь минизал, никто это не контролирует. только музыка хорошая играет",2
"Не плохое место , но кухня немного хромает",5
Идеальное место для отдыха,5
"Полный игнор от заведения. Хотели там повести время с друзьями, ждали ответ на смс целый вечер… так и не ответили!",1
"Приехали после аэропорта в монгол. Сотрудник Максат очень вежливый, делает атмосферу приятнее. Помог нам по всем вопросам, посоветовал классные места в алматы , очень вежливый !",5
Уютно очень,5
Еда и коктейли посредственные,3
хостес или администратор (женщина маленького роста с челкой) испортила нам настроение и первое впечатление! больше ни ногой),1
"Посоветовали кальян. Ну конечно же, всё на высшем уровне. А ещё оказалось, что кухня и обслуживание тоже на высшем уровне.",5
"Понравился кальян , атмосфера топ Спасибо оф Нурсултан за сервис, кухня чуть хромает",4
"Заведение мне не понравилось. Столики там заранее бронировать нельзя как оказалось. Я пришла и заняла место для 6 персон. Сделала заказал. Оставила свою верхнюю одежду рядом со столиком. Как только сделала заказ - отошла в уборную. В уборную зашла девушка с этого персонала и спросила “ Остаюсь ли я или ухожу?”. Я смотрю на нее с удивлением. Ответила: “остаюсь, а в чем дело?” . Они отдали тупо мой столик чужому человеку. Мой официант принял заказ, но посчитал, что я ушла и нужно отдать мой столик другому😁👍🏼  Спросила у него “ Жайма сіздікі ағай? Неге менің столигімді беріп тастайсыз? “ На что он мне ответил 
“ Білә, сіз менімен байқап сөйлеңіз”. Грубый персонал. Имя этого официанта я не помню, но думаю, администрация уже понимает кого я имею в виду. Вся эта История произошла 02.12.2023 после 9 вечера. Администрация этого заведения тоже какие непредусмотренные. Не могли подсказать столик изначально, а потом и вовсе по словам официанта отдали кому то мой столик, который и сами предложили мне. Не приду сюда больше из-за грубого обращения. Была во многих заведениях, но такое со мной впервые, еще и официант грубит)",2
"Мне сама заведения понравилась, но хостес или не знаю кто встретила каменным лицом, одним словом неклиентоориентированная .
Отвечала на вопросы как попало, и испортила настроение на вечер",2
"Кальян не очень, к тому же дорого",2
"Кальян и атмосфера хорошая, но в здание запускают маленьких попрашаек, которые очень наглые стоят возле стола требуя купить всякие безделушки и конфеты за нереальные цены! Плюс администраторы молча смотрят за этим…",2
"На днях были в заведении и нам пробили в чек товар, который мы не брали. За счёт большого количества позиций, данную ошибку мы заметили уже дома, оплатив все. Сейчас же заведение просто не отвечает на смс читая их. Значит это было сделано умышленно официантами. Не советую данное заведение, либо сразу проверяйте весь чек. Я же буду писать уже в органы о защите прав потребителей. Видя столько плохих отзывов, думаю было бы хорошо проверить это заведение на ""вшивость""",1
"Ранее оставляла здесь положительный отзыв. Но чем чаще мы сюда приходили, тем хуже становилось обслуживание. Но из-за хорошей кухни и коктейлей продолжали ходить. 

Последний случай из ряда вон выходящий. Вчера, 17 ноября, мы посетили заведение еще раз. Нам в счет добавили лишние позиции, которые мы не заказывали. Поэтому, если посещаете данное заведение, обязательно перепроверяйте счет!",1
"Отличное заведение! Всё было вкусно, кальяны тут отличные! Хотела отдельно сказать спасибо Галымжану, обслужил на высшем уровне!🥹🫶",5
Хороший кальян,4
"Отвратительный сервис, администарция грубая как и офицанты, блюда нужно ждать по 40-50 минут, подают хододную еду, либо просто ее подогревают!",1
"Очень ГРУБЫЙ ХОСТЕС И АДМИНЫ ( Аселя) 
Больше ни ногой туда.",1
Ждали приема заказа 20мин так и никто не подошел и мы ушли,1
"Дымный кальян , супер сервис от оффа Нурса 
Такой милашка 😍😍😍",5
Ужасное обслуживание . В зале холодно. В туалете грязь. Не советую,1
"Очень вкусная еда, и кальян хороший. Обслуживание всегда на высоте. Очень нравится проводить вечера в таком уютном месте💛",5
"Вкусные коктейли, хороший кальян",5
"Ну ооочень классное место. Вкусная кухня. Хороший кальян. Интерьер прекрасный, уютный. Диджей огонь. Обслуживание на высоте. У нас произошел во время ужина один нюанс. Не по вине ресторана, но тем не менее. Нам сделали комплимент в виде 1 блюда и 1 десерта. Хотя мы даже не возмущались. Остались очень довольны. Спасибо ❤️",5
"Были вчера, кухня не вау, бар хороший, напитки были вкусными, сидели около бара, на баре сидит какая-то девушка то ли кассир то ли помощник бармена славянской внешности, громко матюкается, не особо приятно сидеть и это слушать, тем более от девушки.",3
"Место стало бродячее 
Еда ужасная…",1
"Место отличное , обслуживание тоже, Маржан официант очень понравилась.Рекомендую к посещению.",5
Всегда на уровне,5
"обслуживание официантов на отвали, как будто бесплатно кормят за свой счет",1
"Все очень вкусно, мужчина который обслуживал нас просто шикарный",5
"Заведение ужасное!!! Учитывая что они претендуют на премиум сегмент и ценник там чуть выше среднего обслуживание отсутствует от слов совсем. Пришли вчера 30 сентября с друзьями. Хостес с порога заявила что Вам нужно , ни здравствуйте а с претензией. Далее сели за стол и ждать официанта пришлось вечность. Учитывая что там есть кнопка вызова я устал ее нажимать. Приняли заказ. Готовили долго учитывая что заведение было пустое. Тарелки грязные забрать там не принято))) Ну и вишенка на торте это кальян. Заказали, просили не раскручивать и не перегреть и взяли перегрели. Кальянщик спорил что все ок 😂 ему нормально но курить и платить будет же не он. По итогу сервис дно, его там в принципе нет. Кухня по мне неплохая но без изыска, кальян второй раз переделал второй мастер и было на 3. Так что заведение точно не рекомендую, есть куча аналогичных и с гораздо лучшим обслуживанием.",2
"Заведение очень понравилось, атмосферно, кухня вкусная. Единственный минус это обслуживание, ну очень долгое, официанта, кальянщика ждёшь по 30 минут минимум и это только для того, чтобы заказ приняли 🤦🏻‍♀️",5
Сегодня нас не впустили меня моего друга и иностранца из Франции на входе бородатый охранник. Плохое впечатление по одежде посудили. Сказал идите в Оливер рядом туда идите. Очень плохо поступили особенно гостя из Франции. Деньги были и много…,1
"ТРЕБУЮТ ДЕПОЗИТ С КЛИЕНТОВ!!!
И сегодня нам пришлось уйти, так как за столик в среду потребовали 20 тыс. за 2-х НО уважаемое руководство заведения, в следующий раз я буду ПРИНЦИПИАЛЬНО ВЫЗЫВАТЬ ОРГАНЫ И РАЗБИРАТЬСЯ НА МЕСТЕ.

Или вам законы не писаны?!! 
Пусть вас проверят по всем статьям- я вам это организую✊🏼✊🏼

Ознакомьтесь с правилами. У вас не имеют право требовать с клиентов депозит, тем более пустых столиков было масса.",1
"Бельгийские вафли слишком сухие. Обратите внимание, а так люблю это место",4
"Хорошее место в центре города. Цены чуть выше среднего, а сервис вполне неплох.

Обслуживала официантка Маржан. 

Придём ещё. Спасибо за вечер!",5
"Сервис конечно желает лучшего. За 3.5 часов официант подошел раза 3, блюдо одно ждали почти час. Счет мин 20. Последний мой раз в этом заведении.",1
"Добрый вечер!
Несколько дней назад решили посетить Ваше заведение. Ушли в полном разочаровании…
Бармен славянской внешности не слышал никогда о культуре. На протяжении всего вечера слушали диалоги с нецензурными высказывания. Коктейли в его исполнении просто кошмар… Ну и изюминка на торте - работа бара без перчаток (очень не приятно, когда в ингредиенты для твоего коктейля залезли рукой, которая неизвестно где была до этого). Персонал с каждым разом всё хуже и хуже становится…",1
"Обещали решить наш вопрос с оплатой, и в итоге ничего не решили, не ответили, просто ужас, о клиентах не думают",1
Кальян горчит чуть. Салат из баклажан и курица в кисло-сладком вкусные.,4
"Нам очень понравился Давид, профессионал своего дела. Кальян супер",5
"Место на один раз. Нам не нравится дешёвый пафос и публика, которая считает себя крутой. Еда средняя, кальяны тоже.",3
"Понравились завтраки, отличный кофе ♥️",5
"Уютное заведение с отличной кухней и приветливы эм персоналом. Хостес Сания очень внимательная, приятная девушка. Сегодня взяла говяьи щёчки - тают во рту.",5
"0/10.Оштрафовали за кальян. Администрация плохо работает, не несет никакой ответственности.",1
"Отличный сервис. Еда вкусная. Кальян один из лучших. Спасибо кальянщику Boxy за то что угадывал наши предпочтения. Понравилась подсветка для кальяна развлекались дымом ))
Обслуживание 10/10 спасибо официанту Амаль 👍 
Место куда хочется возвращаться. 
P.s: гости из Шымкента ✊",5
"Отличный сервис,хороший кальянщик Макс и официант Амаль, быстрый,ловкий, внимательный , обходительный , вкусно по еде и классный кальян,советую🫶🏼",5
Такая классная атмосфера 🤗 персонал вежливый! Кальян классный 🤞 Спасибо 😋,5
"Такое заведение и так опошлить телевизорами, будто в маке",1
"Очень классные кальяны, рекомендую. Кухня отличная!",5
Плохое обслуживание и невкусная еда. Не советую,1
"Капец оштрафовали за курение кальяна, администрация не несет ответственность, еще депозит просят, хотя это незаконно.Позор!!!!",1
"Не ходите сюда! С виду приличное заведение а на деле просто подстава, бабки дерут а за клиентов не отвечают! Администрация не несет ответственности за курение кальяна! Не предупредили что нельзя, приехала полиция и оштрафовали нас на ровном месте! На наши возмущения админы кафе хлопают глазами!",1
"Мое любимое заведение. Вкусно, локация хорошая, персонал приветливый. 
Кальянщик Максим молодец. Очень клиентоориентированный.",4
"Красивый интерьер, вежливый персонал и очень вкусная кухня",5
"Очень вкусный бургер от шефа, сытный, вежливый персонал, кажется Атабек и Амаль были нашими официантами, все понравилось. Придем еще",5
Обслуживание как и было год назад плохое так и осталось! Неужели админы не видят это.,1
"Норм континент , популярные место. , но кухня не очень",3
Очень вкусно. Кальян дорогой но курится в 2-3 раза дольше со вкусом чем в укропе каком нибудь),5
"Интерьер и звуковое оборудование - вот за что можно поставить такую оценку, кухня и бар посредственные.",3
"Отличное место, хорошая кухня, кальян, обслуживание",5
"Максим “Boxy” замечательный человек! Сделал нам отличный кальян, очень приятный человек! Подходил раз 10, спрашивал как у нас дела! Спасибо ему большое за его отзывчивость и профессионализм! 🫶",5
"Максим сделал отличный кальян, курили очень долго, не горчил, было круто! Спасибо, большое!🫶🏼",5
Все очень понравилось 🫶,5
Ужасное обслуживание!еда вкусная,1
"Отличное заведение, хорошее обслуживание",5
"Отличное заведения. Вежливый персонал, вкусная кухня и обалденный кальян.",5
"Пришёл покушать 29.07.2033, около 6.00. Был голодный. Охранник сообщил что заведение закрыто. Потратил время.",1
"Супер классный кальян ,кальянщик Диас просто сделал так как мы просили. Идеальное обслуживание 👍🏻. Будем и дальше наслаждаться Вашим персоналом и обслуживанием😆🙈",5
"очень понравилось, такое красивое место, еда вкусная, персонал приятный, удобное расположение, в общем приехала с подругами , отлично отдохнули)",5
"Самое ужасное заведение. Кухня отстой, обслуживание дно… кальян отстой…
Ещё в этом заведении официанты просят написать отзыв о них. Имейте ввиду все хорошие отзывы они сами себе пишут.",1
"Не советую, испортились давно. Место для чаек в основном.",1
"Добрый вечер, 
Вчера были с супругой, нам всё понравилась. 
Девочка по имени Асель очень приятная и воспитанная. 
По больше таких вам сотрудников. Удачи вам и процветания",5
"Некомпетентный персонал !Особенно админ ! Неизвестно кем себя представляют , хотя по факту обслуживающий персонал !",1
Одним словом дно. Не тратьте свое время и деньги на это заведение),1
